{
  "$schema": "https://json-schema.org/draft/2020-12/schema",
  "$id": "https://github.com/dogfood-lab/testing-os/packages/schemas/src/json/dogfood-record.schema.json",
  "title": "Dogfood Record (Persisted)",
  "description": "Canonical persisted record written by the central verifier. Includes all source-authored fields plus verifier-owned fields. Stored in records/ (accepted) or records/_rejected/ (rejected). Never authored by source repos.",
  "type": "object",
  "required": [
    "schema_version",
    "policy_version",
    "run_id",
    "repo",
    "ref",
    "source",
    "timing",
    "scenario_results",
    "overall_verdict",
    "verification"
  ],
  "additionalProperties": false,
  "properties": {

    "schema_version": {
      "type": "string",
      "pattern": "^\\d+\\.\\d+\\.\\d+$",
      "description": "Semver of the persisted record schema."
    },

    "policy_version": {
      "type": "string",
      "pattern": "^\\d+\\.\\d+\\.\\d+$",
      "description": "Semver of the policy this record was evaluated against. Set by verifier."
    },

    "run_id": {
      "type": "string",
      "minLength": 1,
      "pattern": "^[A-Za-z0-9_-]+$",
      "description": "Unique dogfood run identifier. Carried from submission. Charset is constrained because run_id becomes a filesystem path segment in the persisted record path; this mirrors the persist-time guard."
    },

    "repo": {
      "type": "string",
      "pattern": "^[a-zA-Z0-9_.-]+/[a-zA-Z0-9_.-]+$",
      "description": "Full org/repo name."
    },

    "ref": {
      "type": "object",
      "required": ["commit_sha"],
      "additionalProperties": false,
      "properties": {
        "branch": { "type": "string" },
        "commit_sha": {
          "type": "string",
          "pattern": "^[0-9a-f]{40}$"
        },
        "version": {
          "type": "string",
          "description": "Release version tag if applicable."
        }
      }
    },

    "source": {
      "type": "object",
      "required": ["provider", "workflow", "provider_run_id", "run_url"],
      "additionalProperties": false,
      "properties": {
        "provider": {
          "type": "string",
          "enum": ["github"],
          "description": "SCM provider. GitHub-only for now."
        },
        "workflow": {
          "type": "string",
          "description": "Workflow filename that produced the submission."
        },
        "provider_run_id": {
          "type": "string",
          "description": "GitHub Actions run ID (provider-native)."
        },
        "attempt": {
          "type": "integer",
          "minimum": 1,
          "default": 1
        },
        "run_url": {
          "type": "string",
          "format": "uri"
        },
        "actor": {
          "type": "string",
          "description": "GitHub username that triggered the workflow."
        }
      }
    },

    "timing": {
      "type": "object",
      "required": ["started_at", "finished_at"],
      "additionalProperties": false,
      "properties": {
        "started_at": { "type": "string", "format": "date-time" },
        "finished_at": { "type": "string", "format": "date-time" },
        "duration_ms": { "type": "integer", "minimum": 0 }
      }
    },

    "ci_checks": {
      "type": "array",
      "description": "Machine-evaluated CI results. Optional — not all dogfood runs include CI.",
      "items": {
        "type": "object",
        "required": ["id", "kind", "status"],
        "additionalProperties": false,
        "properties": {
          "id": { "type": "string" },
          "kind": {
            "type": "string",
            "enum": ["test", "coverage", "lint", "security", "build", "other"]
          },
          "status": {
            "type": "string",
            "enum": ["pass", "fail", "skip"]
          },
          "value": {
            "type": "number",
            "description": "Numeric result (test count, coverage %, etc.)."
          },
          "threshold": {
            "type": "number",
            "description": "Policy threshold if applicable."
          }
        }
      }
    },

    "scenario_results": {
      "type": "array",
      "minItems": 1,
      "description": "Dogfood evidence. At least one scenario required.",
      "items": {
        "type": "object",
        "required": ["scenario_id", "product_surface", "execution_mode", "verdict", "step_results"],
        "additionalProperties": false,
        "properties": {
          "scenario_id": {
            "type": "string",
            "description": "Stable ID matching a scenario definition in the source repo."
          },
          "scenario_name": { "type": "string" },
          "scenario_version": {
            "type": "string",
            "pattern": "^\\d+\\.\\d+\\.\\d+$"
          },
          "product_surface": {
            "type": "string",
            "enum": ["cli", "desktop", "web", "api", "mcp-server", "npm-package", "plugin", "library"]
          },
          "execution_mode": {
            "type": "string",
            "enum": ["bot", "human", "mixed"]
          },
          "attested_by": {
            "type": "string",
            "description": "Human attester ID. Verifier enforces presence when execution_mode is human or mixed."
          },
          "verdict": {
            "type": "string",
            "enum": ["pass", "fail", "blocked", "partial"]
          },
          "blocking_reason": {
            "type": "string",
            "description": "Required when verdict is blocked. Verifier enforces."
          },
          "step_results": {
            "type": "array",
            "minItems": 1,
            "description": "Per-step execution results. Bridges scenario steps to record evidence.",
            "items": {
              "type": "object",
              "required": ["step_id", "status"],
              "additionalProperties": false,
              "properties": {
                "step_id": {
                  "type": "string",
                  "pattern": "^[a-z0-9][a-z0-9-]*$",
                  "description": "Must match a step.id from the scenario definition."
                },
                "status": {
                  "type": "string",
                  "enum": ["pass", "fail", "blocked", "skip", "partial"]
                },
                "notes": { "type": "string" }
              }
            }
          },
          "evidence": {
            "type": "array",
            "items": {
              "type": "object",
              "required": ["kind", "url"],
              "additionalProperties": false,
              "properties": {
                "kind": {
                  "type": "string",
                  "enum": ["log", "screenshot", "recording", "transcript", "artifact", "other"]
                },
                "url": { "type": "string", "format": "uri" },
                "description": { "type": "string" },
                "expires_at": {
                  "type": "string",
                  "format": "date-time",
                  "description": "When this evidence URL will become unavailable."
                }
              }
            }
          },
          "notes": { "type": "string" }
        }
      }
    },

    "overall_verdict": {
      "type": "object",
      "required": ["proposed", "verified"],
      "additionalProperties": false,
      "description": "Source proposes, verifier confirms or downgrades. Verifier never upgrades.",
      "properties": {
        "proposed": {
          "type": "string",
          "enum": ["pass", "fail", "blocked", "partial"],
          "description": "Verdict as proposed by the source repo."
        },
        "verified": {
          "type": "string",
          "enum": ["pass", "fail", "blocked", "partial"],
          "description": "Final verdict after central verification."
        },
        "downgraded": {
          "type": "boolean",
          "default": false,
          "description": "True if verifier downgraded the proposed verdict."
        },
        "downgrade_reasons": {
          "type": "array",
          "items": { "type": "string" },
          "description": "Machine-readable reasons if verifier downgraded."
        }
      }
    },

    "verification": {
      "type": "object",
      "required": ["status", "verified_at", "provenance_confirmed", "schema_valid", "policy_valid"],
      "description": "Set by the central verifier. Never authored by source.",
      "additionalProperties": false,
      "properties": {
        "status": {
          "type": "string",
          "enum": ["accepted", "rejected"],
          "description": "Final verification outcome. No pending state in persisted records."
        },
        "verified_at": {
          "type": "string",
          "format": "date-time"
        },
        "provenance_confirmed": {
          "type": "boolean",
          "description": "True if GitHub API confirmed the source run exists and matches claims."
        },
        "schema_valid": {
          "type": "boolean",
          "description": "True if submission passed JSON Schema validation."
        },
        "policy_valid": {
          "type": "boolean",
          "description": "True if record satisfies all applicable policy rules."
        },
        "rejection_reasons": {
          "type": "array",
          "items": { "type": "string" },
          "description": "Machine-readable reasons for rejection. Empty if accepted."
        },
        "provenance_remediation": {
          "type": "object",
          "properties": {
            "status": { "type": "string", "enum": ["stub_verified"] },
            "note": { "type": "string", "maxLength": 500 },
            "remediated_at": { "type": "string", "format": "date-time" },
            "original_provenance_confirmed": { "type": ["boolean", "null"] }
          },
          "required": ["status", "remediated_at"],
          "additionalProperties": false
        }
      }
    },

    "notes": {
      "type": "string",
      "description": "Freeform summary from the source."
    },

    "integrity": {
      "type": "object",
      "title": "Integrity Chain Entry",
      "description": "Tamper-evident hash-chain metadata stamped by the persist layer when this record is written. Optional and backward-compatible: records persisted before the integrity chain existed have no integrity block and remain valid. The digest is computed over the record WITH this block removed (you cannot hash the digest into itself), so it is stable regardless of the integrity block's contents.",
      "additionalProperties": false,
      "required": ["submission_digest", "prev_digest", "seq"],
      "properties": {
        "submission_digest": {
          "type": "string",
          "title": "Submission Digest",
          "description": "Lowercase sha256 hex (64 chars) of the canonicalized record with the integrity block removed. Recomputed by the chain verifier to detect tampering.",
          "pattern": "^[0-9a-f]{64}$"
        },
        "prev_digest": {
          "type": "string",
          "title": "Previous Digest",
          "description": "The submission_digest of the previous record in the append-only chain, or 64 zeros (the genesis digest) for the first entry. Links this record to its predecessor.",
          "pattern": "^[0-9a-f]{64}$"
        },
        "seq": {
          "type": "integer",
          "title": "Chain Sequence Number",
          "description": "Monotonic position of this record in the append-only chain, starting at 0 for the genesis entry.",
          "minimum": 0
        }
      }
    }
  }
}
