{
  "schema_version": "1.0.0",
  "policy_version": "1.0.0",
  "run_id": "00mrq9av6e-wCTLSZN_R95k8w",
  "repo": "dogfood-lab/testing-os",
  "ref": {
    "branch": "main",
    "commit_sha": "d4cf8448df21d7a15f77b7541d76c7ec409f41ff"
  },
  "source": {
    "actor": "mcp-tool-shop",
    "attempt": 1,
    "provider": "github",
    "provider_run_id": "29641766083",
    "run_url": "https://github.com/dogfood-lab/testing-os/actions/runs/29641766083",
    "workflow": "CI"
  },
  "timing": {
    "duration_ms": 0,
    "finished_at": "2026-07-18T11:01:17.270Z",
    "started_at": "2026-07-18T11:01:17.270Z"
  },
  "scenario_results": [
    {
      "evidence": [
        {
          "description": "The testing-os CI workflow_run log for the commit under test",
          "kind": "log",
          "url": "https://github.com/dogfood-lab/testing-os/actions/runs/29641766083"
        }
      ],
      "execution_mode": "bot",
      "notes": "Derived from the testing-os CI workflow_run conclusion: success.",
      "product_surface": "cli",
      "scenario_id": "self-verify-gate",
      "scenario_name": "testing-os self-verification gate",
      "scenario_version": "1.0.0",
      "step_results": [
        {
          "status": "pass",
          "step_id": "version-sync-gate"
        },
        {
          "status": "pass",
          "step_id": "doc-drift-gate"
        },
        {
          "status": "pass",
          "step_id": "regression-pins-gate"
        },
        {
          "status": "pass",
          "step_id": "build"
        },
        {
          "status": "pass",
          "step_id": "scripts-suite"
        },
        {
          "status": "pass",
          "step_id": "workspace-suites"
        }
      ],
      "verdict": "pass"
    }
  ],
  "overall_verdict": {
    "proposed": "pass",
    "verified": "pass",
    "downgraded": false
  },
  "verification": {
    "status": "accepted",
    "verified_at": "2026-07-18T11:01:37.602Z",
    "provenance_confirmed": true,
    "schema_valid": true,
    "policy_valid": true,
    "rejection_reasons": []
  },
  "integrity": {
    "submission_digest": "a5ea35392be4a7ef45aca6e8571d3a3322b33b1668cc5df6f595a4835b3ffa4e",
    "prev_digest": "e82231e66d76930afec7c538a5a147145f64d7413d4776fc6a428850b1f3abe0",
    "seq": 14
  }
}
